{
  "captured_at": "2026-05-01T03:50:56.074Z",
  "source": "polymarket",
  "event_id": "79973",
  "event_slug": "2026-seoul-mayoral-election-winner",
  "event_url": "https://polymarket.com/event/2026-seoul-mayoral-election-winner",
  "event_title": "2026 Seoul Mayoral Election Winner",
  "end_date": "2026-06-03T00:00:00Z",
  "total_volume_usd": 33053002.697117,
  "total_liquidity_usd": 3559319.50821,
  "candidates": [
    {
      "name": "Chong Won-oh",
      "name_ko": "정원오",
      "party_id": "dpk",
      "prob": 0.87,
      "volume_usd": 707222.7416280023,
      "market_id": "678937"
    },
    {
      "name": "Oh Se-hoon",
      "name_ko": "오세훈",
      "party_id": "ppp",
      "prob": 0.13,
      "volume_usd": 931335.4124120012,
      "market_id": "678929"
    },
    {
      "name": "Cho Eun-hee",
      "name_ko": "조은희",
      "party_id": "ppp",
      "prob": 0.002,
      "volume_usd": 2894232.118312983,
      "market_id": "678931"
    },
    {
      "name": "Ahn Cheol-soo",
      "name_ko": "안철수",
      "party_id": "ppp",
      "prob": 0.001,
      "volume_usd": 2363550.4792319965,
      "market_id": "678933"
    },
    {
      "name": "Park Yong-jin",
      "name_ko": "박용진",
      "party_id": "dpk",
      "prob": 0.001,
      "volume_usd": 2749996.2287510065,
      "market_id": "678935"
    },
    {
      "name": "Hong Ihk-pyo",
      "name_ko": "홍익표",
      "party_id": "dpk",
      "prob": 0.001,
      "volume_usd": 2741039.321379993,
      "market_id": "678939"
    },
    {
      "name": "Cho Kuk",
      "name_ko": "조국",
      "party_id": "rebuild",
      "prob": 0.001,
      "volume_usd": 2465242.6091960045,
      "market_id": "678941"
    },
    {
      "name": "Kang Hoon-sik ",
      "prob": 0.001,
      "volume_usd": 1924256.461197,
      "market_id": "678943"
    },
    {
      "name": "Na Kyung-won",
      "name_ko": "나경원",
      "party_id": "ppp",
      "prob": 0.001,
      "volume_usd": 3014959.9825019985,
      "market_id": "678930"
    },
    {
      "name": "Han Dong-hoon",
      "prob": 0.001,
      "volume_usd": 2579672.59815498,
      "market_id": "678932"
    },
    {
      "name": "Park Ju-min",
      "name_ko": "박주민",
      "party_id": "dpk",
      "prob": 0.001,
      "volume_usd": 2087283.323063994,
      "market_id": "678934"
    },
    {
      "name": "Park Hong-keun",
      "prob": 0.001,
      "volume_usd": 2882938.1581320297,
      "market_id": "678936"
    },
    {
      "name": "Seo Young-kyo",
      "name_ko": "서영교",
      "party_id": "dpk",
      "prob": 0.001,
      "volume_usd": 3148665.976817015,
      "market_id": "678938"
    },
    {
      "name": "Jeon Hyun-heui",
      "prob": 0.001,
      "volume_usd": 2562894.5733379954,
      "market_id": "678940"
    }
  ],
  "method_notes": "Captured live from Polymarket gamma API. Prob = last_trade_price (binary YES contract)."
}
